,UploadDate,StoryTitle,VideoURL,Description,Status,DownloadManually,DownloadManuallyDrive,PreviewVideo,VideoId
12849,"November 10, 2023","Owner Reads Mean Comments About Her Cat, Shrek",https://www.sunnyskyz.com/happy-videos/12849,"Loved by many for his unique appearance, Shrek has captured the hearts of fans who appreciate the beauty of diversity in our four-legged friends. However, Shrek, like any internet celebrity, is not immune to the occasional 'mean' comment about his distinct looks.",Downloaded,https://tikcdn.io/ssstik/7298713044937461022,https://drive.google.com/uc?export=download&id=1PcdJ7jP59U5Z0Zj_mp-Zj-liV3k5W9aF,https://drive.google.com/file/d/1PcdJ7jP59U5Z0Zj_mp-Zj-liV3k5W9aF/preview,1BC-Px5cFYewNZehL3pFHUFHRwsdKWuVD
12846,"November 9, 2023",A Brother's Hilarious Reaction To His Swaddled Sister's 'Missing' Parts,https://www.sunnyskyz.com/happy-videos/12846,"A little boy in Thousand Oaks, California, met his baby sister for the first time - but he was very confused.",Downloaded,https://tikcdn.io/ssstik/7299284028866465070,https://drive.google.com/uc?export=download&id=16OJ6kygzKCGzijFqkfS129K0XU1FtofL,https://drive.google.com/file/d/16OJ6kygzKCGzijFqkfS129K0XU1FtofL/preview,1eaIlpHEi3LYuvAJFH4Pafh5Zz69btfEe
12844,"November 8, 2023",Priceless Encounter Kids Watch Videos With Gorilla,https://www.sunnyskyz.com/happy-videos/12844,"They might not be talking, but they're speaking the same language.",Downloaded,https://tikcdn.io/ssstik/7298372141156814123,https://drive.google.com/uc?export=download&id=1RjUEa_UstZ0Ch0ydJ7K6I4W_QDA7GD3y,https://drive.google.com/file/d/1RjUEa_UstZ0Ch0ydJ7K6I4W_QDA7GD3y/preview,1TzdVW2xFQQXPMetoWSVcUVlMcfvAQiSl
12843,"November 8, 2023",Extremely Rare Male Soprano Sings Opera,https://www.sunnyskyz.com/happy-videos/12843,"In the world of opera, the term ""soprano"" typically conjures images of powerful female voices soaring through the highest registers, delivering breathtaking performances that leave audiences in awe.",Downloaded,https://tikcdn.io/ssstik/7069301378967014661,https://drive.google.com/uc?export=download&id=1WkZEE3MwBvb-EEU7Skc4yjbvkRpcgIJ_,https://drive.google.com/file/d/1WkZEE3MwBvb-EEU7Skc4yjbvkRpcgIJ_/preview,1AJe02spHDwKewN_GqOPKFLv3o5uIOMSU
12839,"November 7, 2023",Last 10 Finishers Of NYC Marathon Celebrated Like Champions,https://www.sunnyskyz.com/happy-videos/12839,"In a world filled with news of competition, victories, and record-breaking feats, sometimes it's the heartwarming moments of compassion and celebration that truly touch our souls.",Downloaded,https://tikcdn.io/ssstik/7298188639891344686,https://drive.google.com/uc?export=download&id=1p_wkrGC0uzIu24m-6KLOBtDCogbPuD8I,https://drive.google.com/file/d/1p_wkrGC0uzIu24m-6KLOBtDCogbPuD8I/preview,17LE8LEGt4s49e3j7pC9CQmWXviDYAup5
